"zone_name","zone_slug","description","tags","geom","bbox","centroid","area_m2","created_at","is_active","postal_codes","primary_latitude","primary_longitude","boundary_extreme_points","is_ai_visible","is_featured"
"West Maui","west-maui","The leeward coast known for historic Lahaina town, luxury resorts in Kaanapali and Kapalua, and spectacular sunsets.","luxury, sunsets, resorts, snorkeling","[MULTIPOLYGON]","[POLYGON]","POINT(-156.675 20.917)","120000000","2025-11-28","TRUE","96761, 96767","20.889","-156.683","NULL","TRUE","TRUE"
"South Maui","south-maui","The driest and sunniest region, featuring the resort community of Wailea and the bustling beach town of Kihei.","beaches, sun, dry, luxury","[MULTIPOLYGON]","[POLYGON]","POINT(-156.450 20.720)","150000000","2025-11-28","TRUE","96753","20.764","-156.445","NULL","TRUE","TRUE"
"Central Maui","central-maui","The commercial and government hub, home to the main airport (OGG), harbor, and Iao Valley State Park.","commerce, airport, history, lush","[MULTIPOLYGON]","[POLYGON]","POINT(-156.490 20.880)","80000000","2025-11-28","TRUE","96732, 96793","20.889","-156.472","NULL","TRUE","FALSE"
"North Shore","north-shore","famous for big-wave surfing, the start of the Road to Hana, and the eclectic town of Paia.","surf, windsurf, hippie, gateway","[MULTIPOLYGON]","[POLYGON]","POINT(-156.380 20.920)","60000000","2025-11-28","TRUE","96779, 96708","20.916","-156.380","NULL","TRUE","TRUE"
"Upcountry","upcountry","The cooler, high-elevation agricultural slopes of Haleakalā, featuring ranches, gardens, and panoramic views.","volcano, cool, agriculture, views","[MULTIPOLYGON]","[POLYGON]","POINT(-156.320 20.800)","200000000","2025-11-28","TRUE","96768, 96790, 96788","20.839","-156.321","NULL","TRUE","TRUE"
"East Maui","east-maui-hana","A remote, lush rainforest region famous for the winding Road to Hana, waterfalls, and bamboo forests.","jungle, waterfalls, road-to-hana, remote","[MULTIPOLYGON]","[POLYGON]","POINT(-156.000 20.750)","300000000","2025-11-28","TRUE","96713","20.758","-155.988","NULL","TRUE","TRUE"